repo_owner,repo_name,payload_commit_msg,created_at,TRUE_VALUE,Final_Themes,
ckorn,PlayDeb,"openra: 20130514-1~getdeb1 * New upstream version All mods: Destroyed bridges can now be repaired with an engineer. Significantly improved AI. Added (beta) support for left-click mouse orders via the settings menu. Added ""move viewport to group"" hotkey (home key or double tap group number). Exposed several new and/or hidden preferences in the settings menu. Games can now be paused with a hotkey (F9 by default) or by opening the menu in a single player game. New/improved UI for spectators and defeated players. Improved server list and lobby UI. Fixed units attacking enemy units hidden by fog/shroud. Fixed several other visibility-related bugs. Improved range circle contrast against terrain. Fixed UI notification sound issues. Added ""Reset Exploration"" developer option (same effect as the hide-map crate). Fixed the visibility of peripheral effects for spectators/replays (ranks, production bars, etc). Improved aircraft contrail rendering. Fixed issue with harvesters not undocking when a refinery is destroyed. Fixed civilian building rendering. Added in-game player statistics for spectators (RA and D2K only). Added ""Fragile Alliances"" option, allowing alliances to be changed during free-for-all games (RA and D2K only). Added a tooltip that shows provided and drained power (RA and D2K - C&C already had this) Improved ingame chat dialog (RA and D2K only). Red Alert: Added Mobile Gap Generator. Added Mobile Radar Jammer (jams radar and deflects enemy missiles). Added desert theater (ported from C&C plus additional custom tiles by Harrison). Removed Volkov. Added announcer voice upon game start. Civilians now panic when attacked. Added a new desert-themed shellmap inspired by C&C Generals. Added ice floe actors for use on snow maps. Several improvements to the original shellmap. New missions: Allies03, Allies04, Soviet01Classic, MonsterTankMadness, Survival01. New maps: Room Convergence, Ghost Town, Bad Neighbors. Improved maps: Chaos Canyon, Bomber John, Bombardment Islands. Fixed Mechanic repair cursor. Fixed graphics for craters for snow maps. Re-enabled ""Mud"" music track. Fixed supply track shadow. Added unit production hotkeys. Fixed Airfield tooltip. Changed minimap color of gems to blue. Gap Generator shroud now disappears on low-power/death. Added support for Nyerguds music upgrade pack. Fixed target line/flash for Demo Truck targets. Added building death frames for Construction Yard, Power Plants and Ore Refinery. Improved Ore Silo artwork (more fill states). Improved Weapon Factory door animation and prevented the door closing before units exited. Changed building placement color to black on snow maps for increased contrast. Fixed Attack Dog sound. Added duration indicators for units under Chronosphere and Iron Curtain effects. Fixed Tanya shooting buildings and using C4 on barrels. Fixed Chrono Tank being unable to crush infantry/sandbags or trigger mines. Balance changes: Base defense damage reduced against structures. Pillbox armor increased from wood to heavy. Construction Yard armor reduced/health increased. Construction Yard is now unsellable to prevent Mobile Construction Vehicle crate exploit. Superweapon health increased. Chrono Tank damage increased/health increased/Chrono-shift range limit added/Chronosphere prerequisite added. Demo Truck cost increased/health reduced/speed reduced. Disguised Spies are now hidden from enemy GPS. Added build limit to Missile Silo and Tanya. Oil derricks are now repairable by engineers. Minelayers can now detect mines, allowing other units to target and destroy them. Nukes can destroy ore wells and trees. Tesla Tank health increased. Medium Tank damage increased. Mammoth Tank turret rotation speed increased/damage increased. Badger bomber health increased. Cruiser speed increased. Missile Sub accuracy increased. C&C: Building range and a short construction delay added to Construction Yards to prevent base walking. Mobile SAM launcher given to Nod as dedicated mobile AA. Improved explosions. Corrected music.yaml track titles. Tweaked building construction animation speed. Improved cloak and building destruction sounds. Added blue tiberium trees. Fixed blue tiberium not poisoning infantry. Increased crate lifetime and removed level-up crate effect. Fixed infantry running animations. Fixed Viceroid unit decorations (veterancy/group number). Fixed tooltip flickering when moving the mouse. Fixed mouse-interaction bugs in the production palette. Improved tooltip names. Added maps: The Sentinel, Bialystok, No Escapism, Rock Canyon, Slippery Slopes, Skull Valley, Dead in Motion Redux, East vs West redux, Drop Zone, The Hourglass. Added EVA notification for nuclear missile launches. Husk lifetime reduced to 10 seconds. Obelisk is now automatically targeted by units. Balance: Harvester capacity increased. Advanced Comm-Center and Temple of Nod act as a substitute prerequisite of the Comm-Center. Reduced MCV crate probability to 80% to solve Construction Yard sell exploit. MCV can be constructed without a service depot. Construction Yard health reduced. Infantry detect nearby cloaked units. Infantry and vehicle speed on clear terrain increased. Airstrike regen reduced to three minutes. Comm-Center health reduced. Airfield health reduced. Helipad price reduced. Advanced Guard Tower range increased/health reduced/power consumption increased. Advanced Guard Tower missiles improved vs aircraft and vehicles/reduced vs infantry Obelisk range increased. Tank firing rate increased/damage vs light armor increased. Light Tank speed increased/turn rate increased/ROF increased/damage reduced. Turn speeds increased for most units. Recon Bike damage reduced/sight increased/speed increased on clear, reduced on road. Buggy health reduced/sight increased. Flamethrower range reduced/damage increased vs wood. Flame Tank significantly buffed. Chinook price reduced. Helicopter prerequisites changed to Comm-Center/Advanced Tech building. Apache sight increased. Orca ROF reduced/ammo increased/damage reduced/sight increased. Stealth Tank initial stance changed to ""hold-fire."" Increased sight range for Light Tank and APC. A10 sight range increased. Mammoth Tank speed increased/health increased/turret rotation increased/missile spread increased. Stealth Tank range reduced/cloak delay increased/damage vs heavy armor reduced. Turret and Guard Tower range increased. APC damage increased/speed reduced. Artillery range reduced/damage vs wood reduced. Rocket Infantry damage increased vs armor. Increased nuke and Ion Cannon damage vs heavy armor. Grenadier's grenade speed increased. SAM site pop-up speed increased. Humvee / Buggy damage increased. MLRS range reduced/ROF reduced/damage reduced. Recon Bike damage increased vs heavy armor/burst delay added/range reduced. Dune 2000: Removed shroud (uses fog-of-war instead). Buildings are hidden under the fog until they are first seen. Added Medic. Added Stealth Raider. Removed Deviator. Aircraft are now unbuildable. Fixed building positioning and selection boxes. Added husks for units and turrets. Added trails to shells and missiles. Fixed animations for Windtrap, Repair Pad, IX Research. Reduced ""silos needed"" warnings. Husk lifetime reduced to 20 seconds. Added large building radius to construction yard. Improved explosions. Crate probabilities adjusted. New UI button artwork. Added maps: Black Mesa, Black Mesa (large), Dune Boogie, Dune Boogie (large), Brimstone, Death Depths - Modded, Tuck's Sietch. Complete rebalancing from the ground up. Engine: Fixed several desync crashes. Fixed a crash involving keyboard shortcuts and dead units. Fixed a crash involving replays and multiple game sessions on a single machine. Fixed a rare loadscreen crash. Improved logging on game desync. Improved UPnP support via Mono.Nat. Improved freetype support via SharpFont (replaces custom patched Tao.Freetype). Improved dedicated server support. Improved mix file decryption (fixes a crash when playing the ""Mud"" audio track). Introduced a new coordinate model to simplify eventual TS/RA2 support. Initial work to port existing code to new coordinates model. Added a muzzle positioning debug visualization. Added a pathfinder debug visualization. Removed player-configurable range behind the scenes of the color picker. Fixes ""radioactive"" color exploit. Show an improved error message when connecting to a server with incompatible mods. Added automatic map downloads from content.open-ra.org when joining a server with an unknown map. Added support for randomized weapon reports. Improved loading times by removing unnecessary map indexing. Scripted maps can now require human players in specified slots. Allow mods to independently enable/disable shroud and fog of war. Minor pathfinding improvements. Other misc refactoring and code cleanup. Build system and packages: Added a `version` rule to the makefile for setting mod version strings on local development builds. Added a `docs` rule for generating trait documentation. Fixed permission errors in the .deb package. Support `--instdir` options for parallel installation of .deb packages. Added Desura compatibility for Linux. Map Editor and Tools: Added a toolstrip with new and improved tools. Added support for terrain categories. Fixed wrong palette remapping for neutral buildings. Maps are now saved/loaded from the custom maps directory. Fixed legacy map importer. Added a --docs flag for OpenRA.Utility for generating trait documentation.",15/05/2013 19:19,0,,
SupSuper,OpenXcom,"Adjustment to path Highlighting. now takes energy consumption and TU reservation into account. yellow highlighting denotes ""can move here, but cannot perform reserved action"" if no reservation option is chosen, defaults to auto shot.",19/05/2013 17:09,0,,
Karatekiwi,lsdc,total power consumption,21/05/2013 7:27,0,,
Karatekiwi,lsdc,tests for power consumption,21/05/2013 8:00,0,,
milaq,android_device_hp_tenderloin,board: do not set DISABLE_ARM_PIE flag until power consumption issue is fixed,21/05/2013 23:17,0,,
leileiy,d3-1,"Created index.html, index2.html, data.csv and data1.csv Index.html - Original vs. eDVA Tech Energy Savings Comparison Index2.html - Sample donut pie chart with text labels Data.csv - data for index2.html sample donut pie chart data1.csv - potential data file for energy savings chart",23/05/2013 21:20,0,,
rsmin,testfs,53% energy saving,24/05/2013 12:49,0,,
RAZR-K-Devs,android_kernel_motorola_omap4-common,"OMAP: CPU: CPUFREQ: CLOCK: VOLTAGE: LPDD: BOARD: PM: Several fixes for stability to run an stable OPP frequency table with 10 - 12 OPPs. Prior to this commit we changed vp_timeout to u8 to allow boot OMAP with more than 7 OPPs. While browsing the mach-omap2 folder I found some mistakes from ealier commits and fixed these. In my testing phase with the new OPP table I faced random crashes/reboots which were related to voltage/sr calibration rule. Now trying the kernel with including these fixes. We may switch partly or completely to EMIF or SR_CLASS 1.5 if we can't get this to work. Work left to do: USB might be unstable related to usb performance boost mode - Not the boost is the problem but the voltage calibration, so whether we have to fix SR/switch to static voltages (but this may cause higher power consumption, possibly it also helps to set single OPPs to fixed, non-scalabe voltage) - or remove the variable usb performance mode and set a fixed frequency value (600mhz min/max). In current kexec kernel we are facing an issue which causes the user cpufreq policy to be reset to kernel default in suspend/idle mode. This can be simply override by user setting an app dependant frequency lock. This issue also causes the @default_available rule for OPPs to be not effective. As we want to limit the default max frequency at 1.0GHZ we have to solve this problem or just define a new rule in omap2plus-cpufreq.c to prevent policy auto-reset.",25/05/2013 0:58,0,,
RudyLu,gaia,Bug 871437 - change the value of Power save mode threshold to -1 for never case. r=alive,27/05/2013 11:38,0,,
basti35,eFM,energy consumption added,29/05/2013 10:16,0,,
Unvanquished,Unvanquished,Refactor human buildable interference to a form of power consumption. Prepare for having varyig power requirements for different buildable types. The gameplay mechanics should not have changed.,30/05/2013 13:49,0,,
SchedMD,slurm,IPMI - correct math for energy consumption,30/05/2013 16:58,0,,
ibr-alg,wiselib,adding piggyback functionality for stats (also available for crazy heuristics for energy consumption),02/06/2013 12:56,0,,
archlinuxarm,PKGBUILDs,aur/dkms-8192cu disable power saving mode,03/06/2013 6:37,0,,
wetherbeei,SD2013-UIUC,stable power consumption treeemap,04/06/2013 2:27,0,,
alessandroleite,wattsup-java-sdk,"bug fixes, and added the option to plot the power consumption in a chart using JFreeChart",05/06/2013 8:55,0,,
eschulte,goa,TODO measure energy consumption of evolved programs,05/06/2013 19:49,0,,
DragonFlyBSD,DragonFlyBSD,wlan: 802.11 devices and vap is not ready for ALTQ packet schedulers Current power saving queue inject and send queue flush code do not work with ALTQ packet schedulers.,07/06/2013 13:00,0,,
FlatTurtle,MyTurtleSleep,Save power state on sleep,10/06/2013 16:08,0,,
stevetrease,HomeMon,Modified to use Google charts for graphing hourly power consumption.,10/06/2013 20:05,0,,
gabrielmd,contiki,added an output for the energy consumption,13/06/2013 17:52,0,,
tmk,tmk_keyboard,Add power consumptions to doc,19/06/2013 13:38,0,,
sonhuytran,Code.Forces.Problem.Set,10A - Power Consumption Calculation,20/06/2013 14:08,0,,
gridcentric,cobalt,"Merge ""Save power_state in export"" into stable/folsom",21/06/2013 13:23,0,,
gridcentric,cobalt,Update notes for submitted changes * Save power_state in export,21/06/2013 13:23,0,,
hhjjj,WaterDrop.X,4 kHz PWM out / 1 mA power consumption,23/06/2013 16:45,0,,
drowningchild,dc-geebus,"mmc: core: Allow changing bus frequency for SD/eMMC cards in runtime Currently, bus frequency is set during the card initialization and never changed until a new card is inserted. In some low power use cases, scaling the clock frequencies while the card is in transfer state would allow power savings. This change allows bus frequency to be changed after the card initialization. Change-Id: Iac064221199f69d162d91f5311becd735c15700a Signed-off-by: Sujit Reddy Thumma <sthumma@codeaurora.org> Signed-off-by: Paul Reioux <reioux@gmail.com> Conflicts: drivers/mmc/core/core.h drivers/mmc/core/mmc.c",23/06/2013 22:45,0,,
bdossantos,dashboard,Add notes about power saving,25/06/2013 13:43,0,,
Thutmose,concrete,"started adding more to the API, basic work on the power consumption for lifts.",02/07/2013 5:06,0,,
julienrf,resilience,- Do not use requirejs optimizer - Monitor power consumption,02/07/2013 15:31,0,,
alessandroleite,scaling-nemesis,added the script to filter the power consumption when it's greater than 99.0,03/07/2013 8:06,0,,
talos,talos.github.com,Added post on energy efficiency in nyc buildings,05/07/2013 22:09,0,,
reddikih,spsim2,modefied calculation of energy efficiency.,06/07/2013 13:26,0,,
mozilla,mozilla-central,"Bug 888552 - Use SET ps command to configure power save mode, r=vchang",09/07/2013 20:32,0,,
ahjortland,hg_proc,"evap_fan_modeling.py - Output rtu after modifying the original rtu dataframe to add the duration of each data point, the uncertainty and the average fan power consumption of the data points. Signed-off-by: Howard Cheung <howard.at@gmail.com>",11/07/2013 20:14,0,,
usk,freebsd,"Import wpa_supplicant / hostapd 2.0. 2013-01-12 - v2.0 * added AP-STA-DISCONNECTED ctrl_iface event * improved debug logging (human readable event names, interface name included in more entries) * added number of small changes to make it easier for static analyzers to understand the implementation * added a workaround for Windows 7 Michael MIC failure reporting and use of the Secure bit in EAPOL-Key msg 3/4 * fixed number of small bugs (see git logs for more details) * changed OpenSSL to read full certificate chain from server_cert file * nl80211: number of updates to use new cfg80211/nl80211 functionality - replace monitor interface with nl80211 commands - additional information for driver-based AP SME * EAP-pwd: - fix KDF for group 21 and zero-padding - added support for fragmentation - increased maximum number of hunting-and-pecking iterations * avoid excessive Probe Response retries for broadcast Probe Request frames (only with drivers using hostapd SME/MLME) * added preliminary support for using TLS v1.2 (CONFIG_TLSV12=y) * fixed WPS operation stopping on dual concurrent AP * added wps_rf_bands configuration parameter for overriding RF Bands value for WPS * added support for getting per-device PSK from RADIUS Tunnel-Password * added support for libnl 3.2 and newer * increased initial group key handshake retransmit timeout to 500 ms * added a workaround for 4-way handshake to update SNonce even after having sent EAPOL-Key 3/4 to avoid issues with some supplicant implementations that can change SNonce for each EAP-Key 2/4 * added a workaround for EAPOL-Key 4/4 using incorrect type value in WPA2 mode (some deployed stations use WPA type in that message) * added a WPS workaround for mixed mode AP Settings with Windows 7 * changed WPS AP PIN disabling mechanism to disable the PIN after 10 consecutive failures in addition to using the exponential lockout period * added support for WFA Hotspot 2.0 - GAS/ANQP advertisement of network information - disable_dgaf parameter to disable downstream group-addressed forwarding * simplified licensing terms by selecting the BSD license as the only alternative * EAP-SIM: fixed re-authentication not to update pseudonym * EAP-SIM: use Notification round before EAP-Failure * EAP-AKA: added support for AT_COUNTER_TOO_SMALL * EAP-AKA: skip AKA/Identity exchange if EAP identity is recognized * EAP-AKA': fixed identity for MK derivation * EAP-AKA': updated to RFC 5448 (username prefixes changed); note: this breaks interoperability with older versions * EAP-SIM/AKA: allow pseudonym to be used after unknown reauth id * changed ANonce to be a random number instead of Counter-based * added support for canceling WPS operations with hostapd_cli wps_cancel * fixed EAP/WPS to PSK transition on reassociation in cases where deauthentication is missed * hlr_auc_gw enhancements: - a new command line parameter -u can be used to enable updating of SQN in Milenage file - use 5 bit IND for SQN updates - SQLite database can now be used to store Milenage information * EAP-SIM/AKA DB: added optional use of SQLite database for pseudonyms and reauth data * added support for Chargeable-User-Identity (RFC 4372) * added radius_auth_req_attr and radius_acct_req_attr configuration parameters to allow adding/overriding of RADIUS attributes in Access-Request and Accounting-Request packets * added support for RADIUS dynamic authorization server (RFC 5176) * added initial support for WNM operations - BSS max idle period - WNM-Sleep Mode * added new WPS NFC ctrl_iface mechanism - removed obsoleted WPS_OOB command (including support for deprecated UFD config_method) * added FT support for drivers that implement MLME internally * added SA Query support for drivers that implement MLME internally * removed default ACM=1 from AC_VO and AC_VI * changed VENDOR-TEST EAP method to use proper private enterprise number (this will not interoperate with older versions) * added hostapd.conf parameter vendor_elements to allow arbitrary vendor specific elements to be added to the Beacon and Probe Response frames * added support for configuring GCMP cipher for IEEE 802.11ad * added support for 256-bit AES with internal TLS implementation * changed EAPOL transmission to use AC_VO if WMM is active * fixed EAP-TLS/PEAP/TTLS/FAST server to validate TLS Message Length correctly; invalid messages could have caused the hostapd process to terminate before this fix [CVE-2012-4445] * limit number of active wildcard PINs for WPS Registrar to one to avoid confusing behavior with multiple wildcard PINs * added a workaround for WPS PBC session overlap detection to avoid interop issues with deployed station implementations that do not remove active PBC indication from Probe Request frames properly * added support for using SQLite for the eap_user database * added Acct-Session-Id attribute into Access-Request messages * fixed EAPOL frame transmission to non-QoS STAs with nl80211 (do not send QoS frames if the STA did not negotiate use of QoS for this association) 2012-05-10 - v1.0 * Add channel selection support in hostapd. See hostapd.conf. * Add support for IEEE 802.11v Time Advertisement mechanism with UTC TSF offset. See hostapd.conf for config info. * Delay STA entry removal until Deauth/Disassoc TX status in AP mode. This allows the driver to use PS buffering of Deauthentication and Disassociation frames when the STA is in power save sleep. Only available with drivers that provide TX status events for Deauth/ Disassoc frames (nl80211). * Allow PMKSA caching to be disabled on the Authenticator. See hostap.conf config parameter disable_pmksa_caching. * atheros: Add support for IEEE 802.11w configuration. * bsd: Add support for setting HT values in IFM_MMASK. * Allow client isolation to be configured with ap_isolate. Client isolation can be used to prevent low-level bridging of frames between associated stations in the BSS. By default, this bridging is allowed. * Allow coexistance of HT BSSes with WEP/TKIP BSSes. * Add require_ht config parameter, which can be used to configure hostapd to reject association with any station that does not support HT PHY. * Add support for writing debug log to a file using ""-f"" option. Also add relog CLI command to re-open the log file. * Add bridge handling for WDS STA interfaces. By default they are added to the configured bridge of the AP interface (if present), but the user can also specify a separate bridge using cli command wds_bridge. * hostapd_cli: - Add wds_bridge command for specifying bridge for WDS STA interfaces. - Add relog command for reopening log file. - Send AP-STA-DISCONNECTED event when an AP disconnects a station due to inactivity. - Add wps_config ctrl_interface command for configuring AP. This command can be used to configure the AP using the internal WPS registrar. It works in the same way as new AP settings received from an ER. - Many WPS/WPS ER commands - see WPS/WPS ER sections for details. - Add command get version, that returns hostapd version string. * WNM: Add BSS Transition Management Request for ESS Disassoc Imminent. Use hostapd_cli ess_disassoc (STA addr) (URL) to send the notification to the STA. * Allow AP mode to disconnect STAs based on low ACK condition (when the data connection is not working properly, e.g., due to the STA going outside the range of the AP). Disabled by default, enable by config option disassoc_low_ack. * Add WPA_IGNORE_CONFIG_ERRORS build option to continue in case of bad config file. * WPS: - Send AP Settings as a wrapped Credential attribute to ctrl_iface in WPS-NEW-AP-SETTINGS. - Dispatch more WPS events through hostapd ctrl_iface. - Add mechanism for indicating non-standard WPS errors. - Change concurrent radio AP to use only one WPS UPnP instance. - Add wps_check_pin command for processing PIN from user input. UIs can use this command to process a PIN entered by a user and to validate the checksum digit (if present). - Add hostap_cli get_config command to display current AP config. - Add new hostapd_cli command, wps_ap_pin, to manage AP PIN at runtime and support dynamic AP PIN management. - Disable AP PIN after 10 consecutive failures. Slow down attacks on failures up to 10. - Allow AP to start in Enrollee mode without AP PIN for probing, to be compatible with Windows 7. - Add Config Error into WPS-FAIL events to provide more info to the user on how to resolve the issue. - When controlling multiple interfaces: - apply WPS commands to all interfaces configured to use WPS - apply WPS config changes to all interfaces that use WPS - when an attack is detected on any interface, disable AP PIN on all interfaces * WPS ER: - Show SetSelectedRegistrar events as ctrl_iface events. - Add special AP Setup Locked mode to allow read only ER. ap_setup_locked=2 can now be used to enable a special mode where WPS ER can learn the current AP settings, but cannot change them. * WPS 2.0: Add support for WPS 2.0 (CONFIG_WPS2) - Add build option CONFIG_WPS_EXTENSIBILITY_TESTING to enable tool for testing protocol extensibility. - Add build option CONFIG_WPS_STRICT to allow disabling of WPS workarounds. - Add support for AuthorizedMACs attribute. * TDLS: - Allow TDLS use or TDLS channel switching in the BSS to be prohibited in the BSS, using config params tdls_prohibit and tdls_prohibit_chan_switch. * EAP server: Add support for configuring fragment size (see fragment_size in hostapd.conf). * wlantest: Add a tool wlantest for IEEE802.11 protocol testing. wlantest can be used to capture frames from a monitor interface for realtime capturing or from pcap files for offline analysis. * Interworking: Support added for 802.11u. Enable in .config with CONFIG_INTERWORKING. See hostapd.conf for config parameters for interworking. * Android: Add build and runtime support for Android hostapd. * Add a new debug message level for excessive information. Use -ddd to enable. * TLS: Add support for tls_disable_time_checks=1 in client mode. * Internal TLS: - Add support for TLS v1.1 (RF ...",13/07/2013 18:30,0,,
hsenot,mapfolio,Re-arranged data directory and added energy efficiency projects PDFs,14/07/2013 3:26,0,,
CornuAmmonis,critters,"Tweak console output, change scaling for energy consumption",15/07/2013 8:03,0,,
