repo_owner,repo_name,payload_commit_msg,created_at,TRUE_VALUE,Final_Themes,
nicedude,N64_Controller_Wireless_Rumble,"added approximated power consumption, started pcb layout, finished some of wireless module schematic",13/03/2012 22:10,0,,
roalex,cos_packages_apps_Settings,Fix 4560303: Add setting to lock later when power button pressed This adds a feature to delay locking the device when the power button is pressed. This fixes a use case where the user wants to turn off the display (e.g. to save power) but doesn't want to lock the device. Change-Id: I711a81c3e79f7accdc1d9cb217b7806a0b8fcf63,29/03/2012 3:27,0,,
Andromadus,htc-kernel-msm7x30,Disable 802.11n in bcm4329 module. Fixes issue where power saving does not work on certain APs under certain conditions causing wifi to drop during sleep without notice. (credit goes to nyt for patch),10/04/2012 19:24,0,,
mysmartgrid,msg-flukso,A new device notification event has been created: the Energy Consumption Forecast Report.,17/04/2012 14:51,0,,
brunogirin,nhtg12,Added reference to Energy Saving Trust,21/04/2012 14:34,0,,
vdemeester,xorg-config,Disable statnot for now (power consumption),21/04/2012 19:46,0,,
vadonka,lge-kernel-kang,"Linux 3.0.31 (cherry picked from commit bea37381fd9a34c6660e5195d31beea86aa3dda3) nfs: Enclose hostname in brackets when needed in nfs_do_root_mount commit 98a2139f4f4d7b5fcc3a54c7fddbe88612abed20 upstream. When hostname contains colon (e.g. when it is an IPv6 address) it needs to be enclosed in brackets to make parsing of NFS device string possible. Fix nfs_do_root_mount() to enclose hostname properly when needed. NFS code actually does not need this as it does not parse the string passed by nfs_do_root_mount() but the device string is exposed to userspace in /proc/mounts. CC: Josh Boyer <jwboyer@redhat.com> CC: Trond Myklebust <Trond.Myklebust@netapp.com> Signed-off-by: Jan Kara <jack@suse.cz> Signed-off-by: Trond Myklebust <Trond.Myklebust@netapp.com> Signed-off-by: Greg Kroah-Hartman <gregkh@linuxfoundation.org> (cherry picked from commit cb2fee3223eaaeaab386d635fa905ad3925ca539) NFSv4: Ensure that the LOCK code sets exception->inode commit 05ffe24f5290dc095f98fbaf84afe51ef404ccc5 upstream. All callers of nfs4_handle_exception() that need to handle NFS4ERR_OPENMODE correctly should set exception->inode Signed-off-by: Trond Myklebust <Trond.Myklebust@netapp.com> Signed-off-by: Greg Kroah-Hartman <gregkh@linuxfoundation.org> (cherry picked from commit 03a9f194904985d2844a2906ba02306289b0b4e7) NFSv4: Ensure that we check lock exclusive/shared type against open modes commit 55725513b5ef9d462aa3e18527658a0362aaae83 upstream. Since we may be simulating flock() locks using NFS byte range locks, we can't rely on the VFS having checked the file open mode for us. Signed-off-by: Trond Myklebust <Trond.Myklebust@netapp.com> Signed-off-by: Greg Kroah-Hartman <gregkh@linuxfoundation.org> (cherry picked from commit 95cb2c603f27af05871e3e6718b6e1e1a6f59417) x86, apic: APIC code touches invalid MSR on P5 class machines commit cbf2829b61c136edcba302a5e1b6b40e97d32c00 upstream. Current APIC code assumes MSR_IA32_APICBASE is present for all systems. Pentium Classic P5 and friends didn't have this MSR. MSR_IA32_APICBASE was introduced as an architectural MSR by Intel @ P6. Code paths that can touch this MSR invalidly are when vendor == Intel && cpu-family == 5 and APIC bit is set in CPUID - or when you simply pass lapic on the kernel command line, on a P5. The below patch stops Linux incorrectly interfering with the MSR_IA32_APICBASE for P5 class machines. Other code paths exist that touch the MSR - however those paths are not currently reachable for a conformant P5. Signed-off-by: Bryan O'Donoghue <bryan.odonoghue@linux.intel.com> Link: http://lkml.kernel.org/r/4F8EEDD3.1080404@linux.intel.com Signed-off-by: H. Peter Anvin <hpa@linux.intel.com> Signed-off-by: Greg Kroah-Hartman <gregkh@linuxfoundation.org> (cherry picked from commit 322fd620a858fab9c1ea85a7cfebe3fc041d7126) Revert ""autofs: work around unhappy compat problem on x86-64"" commit fcbf94b9dedd2ce08e798a99aafc94fec8668161 upstream. This reverts commit a32744d4abae24572eff7269bc17895c41bd0085. While that commit was technically the right thing to do, and made the x86-64 compat mode work identically to native 32-bit mode (and thus fixing the problem with a 32-bit systemd install on a 64-bit kernel), it turns out that the automount binaries had workarounds for this compat problem. Now, the workarounds are disgusting: doing an ""uname()"" to find out the architecture of the kernel, and then comparing it for the 64-bit cases and fixing up the size of the read() in automount for those. And they were confused: it's not actually a generic 64-bit issue at all, it's very much tied to just x86-64, which has different alignment for an 'u64' in 64-bit mode than in 32-bit mode. But the end result is that fixing the compat layer actually breaks the case of a 32-bit automount on a x86-64 kernel. There are various approaches to fix this (including just doing a ""strcmp()"" on current->comm and comparing it to ""automount""), but I think that I will do the one that teaches pipes about a special ""packet mode"", which will allow user space to not have to care too deeply about the padding at the end of the autofs packet. That change will make the compat workaround unnecessary, so let's revert it first, and get automount working again in compat mode. The packetized pipes will then fix autofs for systemd. Reported-and-requested-by: Michael Tokarev <mjt@tls.msk.ru> Cc: Ian Kent <raven@themaw.net> Signed-off-by: Linus Torvalds <torvalds@linux-foundation.org> Signed-off-by: Greg Kroah-Hartman <gregkh@linuxfoundation.org> (cherry picked from commit d25895e8f1e5e29823d373096d8f3d271bf11821) xen: correctly check for pending events when restoring irq flags commit 7eb7ce4d2e8991aff4ecb71a81949a907ca755ac upstream. In xen_restore_fl_direct(), xen_force_evtchn_callback() was being called even if no events were pending. This resulted in (depending on workload) about a 100 times as many xen_version hypercalls as necessary. Fix this by correcting the sense of the conditional jump. This seems to give a significant performance benefit for some workloads. There is some subtle tricksy ""..since the check here is trying to check both pending and masked in a single cmpw, but I think this is correct. It will call check_events now only when the combined mask+pending word is 0x0001 (aka unmasked, pending)."" (Ian) Acked-by: Ian Campbell <ian.campbell@citrix.com> Signed-off-by: David Vrabel <david.vrabel@citrix.com> Signed-off-by: Konrad Rzeszutek Wilk <konrad.wilk@oracle.com> Signed-off-by: Greg Kroah-Hartman <gregkh@linuxfoundation.org> (cherry picked from commit aa4a6ac6d1eec0fb5c88cbc352a056ae826bc985) xen/smp: Fix crash when booting with ACPI hotplug CPUs. commit cf405ae612b0f7e2358db7ff594c0e94846137aa upstream. When we boot on a machine that can hotplug CPUs and we are using 'dom0_max_vcpus=X' on the Xen hypervisor line to clip the amount of CPUs available to the initial domain, we get this: (XEN) Command line: com1=115200,8n1 dom0_mem=8G noreboot dom0_max_vcpus=8 sync_console mce_verbosity=verbose console=com1,vga loglvl=all guest_loglvl=all .. snip.. DMI: Intel Corporation S2600CP/S2600CP, BIOS SE5C600.86B.99.99.x032.072520111118 07/25/2011 .. snip. SMP: Allowing 64 CPUs, 32 hotplug CPUs installing Xen timer for CPU 7 cpu 7 spinlock event irq 361 NMI watchdog: disabled (cpu7): hardware events not enabled Brought up 8 CPUs .. snip.. [acpi processor finds the CPUs are not initialized and starts calling arch_register_cpu, which creates /sys/devices/system/cpu/cpu8/online] CPU 8 got hotplugged CPU 9 got hotplugged CPU 10 got hotplugged .. snip.. initcall 1_acpi_battery_init_async+0x0/0x1b returned 0 after 406 usecs calling erst_init+0x0/0x2bb @ 1 [and the scheduler sticks newly started tasks on the new CPUs, but said CPUs cannot be initialized b/c the hypervisor has limited the amount of vCPUS to 8 - as per the dom0_max_vcpus=8 flag. The spinlock tries to kick the other CPU, but the structure for that is not initialized and we crash.] BUG: unable to handle kernel paging request at fffffffffffffed8 IP: [<ffffffff81035289>] xen_spin_lock+0x29/0x60 PGD 180d067 PUD 180e067 PMD 0 Oops: 0002 [#1] SMP CPU 7 Modules linked in: Pid: 1, comm: swapper/0 Not tainted 3.4.0-rc2upstream-00001-gf5154e8 #1 Intel Corporation S2600CP/S2600CP RIP: e030:[<ffffffff81035289>] [<ffffffff81035289>] xen_spin_lock+0x29/0x60 RSP: e02b:ffff8801fb9b3a70 EFLAGS: 00010282 With this patch, we cap the amount of vCPUS that the initial domain can run, to exactly what dom0_max_vcpus=X has specified. In the future, if there is a hypercall that will allow a running domain to expand past its initial set of vCPUS, this patch should be re-evaluated. Signed-off-by: Konrad Rzeszutek Wilk <konrad.wilk@oracle.com> Signed-off-by: Greg Kroah-Hartman <gregkh@linuxfoundation.org> (cherry picked from commit 5b09471039a7e08329eb1f48f2153bd979188351) ASoC: dapm: Ensure power gets managed for line widgets commit 7e1f7c8a6e517900cd84da1b8ae020f08f286c3b upstream. Line widgets had not been included in either the power up or power down sequences so if a widget had an event associated with it that event would never be run. Fix this minimally by adding them to the sequences, we should probably be doing away with the specific widget types as they all have the same priority anyway. Signed-off-by: Mark Brown <broonie@opensource.wolfsonmicro.com> Signed-off-by: Greg Kroah-Hartman <gregkh@linuxfoundation.org> (cherry picked from commit 7a47462902d03c6e4d3412a5b703069f4dd13c44) dmaengine: at_hdmac: remove clear-on-read in atc_dostart() commit ed8b0d67f33518a16c6b2450fe5ebebf180c2d04 upstream. This loop on EBCISR register was designed to clear IRQ sources before enabling a DMA channel. This register is clear-on-read so a race condition can appear if another channel is already active and has just finished its transfer. Removing this read on EBCISR is fixing the issue as there is no case where an IRQ could be pending: we already make sure that this register is drained at probe() time and during resume. Signed-off-by: Nicolas Ferre <nicolas.ferre@atmel.com> Signed-off-by: Vinod Koul <vinod.koul@linux.intel.com> Signed-off-by: Greg Kroah-Hartman <gregkh@linuxfoundation.org> (cherry picked from commit 17a766decb63b6fe4c43c06069b92b4958d7a642) hwmon: fam15h_power: fix bogus values with current BIOSes commit 00250ec90963b7ef6678438888f3244985ecde14 upstream. Newer BKDG[1] versions recommend a different initialization value for the running average range register in the northbridge. This improves the power reading by avoiding counter saturations resulting in bogus values for anything below about 80% of TDP power consumption. Updated BIOSes will have this new value set up from the beginning, but meanwhile we correct this value ourselves. This needs to be done on all northbridges, even on those where the driver itself does not register at. This fixes the driver on all current machines to provide proper values for idle load. [1] http://support.amd.com/us/Processor_TechDocs/42301_15h_Mod_00h- ...",07/05/2012 16:31,0,,
postgres,postgres,"Improve control logic for bgwriter hibernation mode. Commit 6d90eaaa89a007e0d365f49d6436f35d2392cfeb added a hibernation mode to the bgwriter to reduce the server's idle-power consumption. However, its interaction with the detailed behavior of BgBufferSync's feedback control loop wasn't very well thought out. That control loop depends primarily on the rate of buffer allocation, not the rate of buffer dirtying, so the hibernation mode has to be designed to operate only when no new buffer allocations are happening. Also, the check for whether the system is effectively idle was not quite right and would fail to detect a constant low level of activity, thus allowing the bgwriter to go into hibernation mode in a way that would let the cycle time vary quite a bit, possibly further confusing the feedback loop. To fix, move the wakeup support from MarkBufferDirty and SetBufferCommitInfoNeedsSave into StrategyGetBuffer, and prevent the bgwriter from entering hibernation mode unless no buffer allocations have happened recently. In addition, fix the delaying logic to remove the problem of possibly not responding to signals promptly, which was basically caused by trying to use the process latch's is_set flag for multiple purposes. I can't prove it but I'm suspicious that that hack was responsible for the intermittent ""postmaster does not shut down"" failures we've been seeing in the buildfarm lately. In any case it did nothing to improve the readability or robustness of the code. In passing, express the hibernation sleep time as a multiplier on BgWriterDelay, not a constant. I'm not sure whether there's any value in exposing the longer sleep time as an independently configurable setting, but we can at least make it act like this for little extra code.",10/05/2012 3:45,0,,
ajalkane,profilematic,"Removed power saving mode from credential warning, it seems to not be affected by the missing credential.",22/05/2012 16:27,0,,
CalVR,calvr_plugins,Adding Sound affected by power consumption values.,23/05/2012 20:13,0,,
X3N0-Life-Form,AVPoV,aspov-primaries-wep.tbm: added anticap + heavy anticap tech description + reduced heavy anticap + sniper gun energy consumption + fixed typo large canon => large cannon + matched title and tech titles,31/05/2012 9:50,0,,
lincomatic,LeafCAN,added instantaneous power consumption in KW,04/06/2012 0:15,0,,
flackr,dungeon,Fix power consumption tracking across multiple clients.,09/06/2012 19:31,0,,
NickStupich,PIC-dev-work,"loop or interrupt based bit flipping working, power consumption measured at 41-49mA (pic24h vs pic33f) at 3.0 V",11/06/2012 22:06,0,,
TI-OpenLink,18xx-ti-utils,"Update wl6/7 FW versions : single role X.3.10.2.114 multi role: X.5.7.0.26 Single Role Firmware =================== 6.3.8.1.111/ 7.3.8.1.111 - fix for invalid 11n incoming beacons we set the duration for HT mixed Mode. - Bug Fix Mcs00111501 Wi-Fi Wpsv2 Aput 4.2.13:The Aput Connected When Overlapped Pbc Sessions. Fixed several issues in generic_ie_parser and anded support for pbc in probe response 1. In function FindAttribute fixed an issue where the while was stopped after one iteration. 2. In function FindAttribute fixed an issue where the pointer was increased only by attribute payload length without the header length. 3. Added support for IE that uses BIG Endian. 4. Added function that search and indicates whether the PBC was pressed the probe response WSC IE and we use that function to decide if to raise the probe to the host or drop it. - fix Security Padding (Under a compliation flag ,FW_SECURITY_PADDING - Default = Disabled!!!!) : Move Security Padding handler from Host to FW. FW will be in charge for adding the security padding for each data packet according to security type. - Bug Fix MCS00111964 - Schedule scan: Detecting of AP with suitable SSID , but not suitable privacy causes recovery during scheduled scan. - Bug fix MCS00112154 (SUT): QuattroL HP-FEM; 2.4GHz; HW_WD_EXPIRE FW PC=0x21de2 during Connection on CH 11. On HP FEM reduce Rx gain level for LTE better coexistence - Bug Fix MCS00112566 - WiFi Direct: Recovery occurs after successful group formation. PowerSaveModule_ExitPowerSaveByClient() - function callback points to null! 6.3.9.2.112/ 7.3.9.2.112 - Added two more Probe Request types for application scan (one shot), and changed the Older Probe Request templates to Connection scan (sched scan) probes. also changed the probe to be regular and role aware and role protected. - Enabling connection scan while STA is connected. The whole connection scan process was wrapped with enter/exit power save. A client (POWER_SAVE_CONN_SCAN_CLIENT_ID) for the connection scan was added to the PS module. PS module is now responsible of launching the connection scan process by invoking ProcessConnectionScanEnterPSCB after entering PS success. 6.3.10.2.113/ 7.3.10.2.113 - IPv6 Feature offloading - added functionality to Fw for Auto response to Neighbour Solicitaion frames. 6.3.10.2.114/ 7.3.10.2.114 - During opening a tx ba seesion, if the recipient returns addba response with winSize smaller than we requested, we don't update it properly upon the TBC_Init. - rx_streaming.c: Go over all the TIDs (8) instead of RX_STRAMING_NUM_OF_TID_SUPPORTED (4). Also send the TID instead of the TIDindex. - Bug Fix MCS00113136 - WiFi TGn APUT 4.2.31: The APUT doesn't turn on the HT non-member protection bit - Bug Fix MCS00110974 - APUT : Beacon stops while UDP RX traffic - Wrong AIFSN calculation. - Bug Fix for TC5.2.2 - PM bit was set in the probe request. Multi Role Firmware =================== 6.5.6.0.24 / 7.5.6.0.24 - Universal scan feature 6.5.7.0.25 / 7.5.7.0.25 - Enabling connection scan while STA is connected. The whole connection scan process was wrapped with enter/exit power save. A client (POWER_SAVE_CONN_SCAN_CLIENT_ID) for the connection can was added to the PS module. PS module is now responsible of launching the connection scan process by invoking processConnectionScanEnterPSCB after entering PS success. - Align the IPv6 APIs with the Host. IPv6 offload is not supported in MR FW. FW will return CMD_STATUS_SUCCESS. 6.5.7.0.26 / 7.5.7.0.26 - During opening a tx ba seesion, if the recipient returns addba response with winSize smaller than we requested, we don't update it properly upon the TBC_Init. - Bug Fix MCS00112495:BSS preamble: worng duration. We didn't configure correctly the immediate response rate. We need to used FW format of rates and not the HW format. - Wrong calculation of the MPDU size. This is because the FwCtrl of the fw-generated was not initialized. - Bug Fix MCS00111964: Schedule scan: Detecting of AP with suitable SSID, but not suitable privacy causes recovery during scheduled scan. - fix for invalid 11n incoming beacons we set the duration for HT mixed Mode. - Bug Fix MCS00102599 FW - R5 MR: """"keep alive"""" frames are NOT sent. - The auto ARP address3 was not set correctly in TxEngine_PrepTemplateHeader. Instead it is set in arpFltr_dequeueResponseFrameInfo. - Bug Fix MCS00110974 - APUT : Beacon stops while UDP RX traffic - Wrong AIFSN calculation. - Bug Fix for TC5.2.2 - PM bit was set in the probe request Signed-off-by: Assaf Azulay <assaf@ti.com>",15/06/2012 7:03,0,,
Rover-Yu,skbtrace-kernel,"tick: Add tick skew boot option Let the user decide whether power consumption or jitter is the more important consideration for their machines. Quoting removal commit af5ab277ded04bd9bc6b048c5a2f0e7d70ef0867: ""Historically, Linux has tried to make the regular timer tick on the various CPUs not happen at the same time, to avoid contention on xtime_lock. Nowadays, with the tickless kernel, this contention no longer happens since time keeping and updating are done differently. In addition, this skew is actually hurting power consumption in a measurable way on many-core systems."" Problems: - Contrary to the above, systems do encounter contention on both xtime_lock and RCU structure locks when the tick is synchronized. - Moderate sized RT systems suffer intolerable jitter due to the tick being synchronized. - SGI reports the same for their large systems. - Fully utilized systems reap no power saving benefit from skew removal, but do suffer from resulting induced lock contention. - 0209f649 rcu: limit rcu_node leaf-level fanout This patch was born to combat lock contention which testing showed to have been _induced by_ skew removal. Skew the tick, contention disappeared virtually completely. Signed-off-by: Mike Galbraith <mgalbraith@suse.de> Link: http://lkml.kernel.org/r/1336472458.21924.78.camel@marge.simpson.net Signed-off-by: Thomas Gleixner <tglx@linutronix.de>",18/06/2012 8:45,0,,
Cheng-SG,BubbleCode,Add power consumption caculation and storage,20/06/2012 8:12,0,,
bidouilles,bGeigieNano,Update power consumption summary table,06/07/2012 3:40,0,,
mysmartgrid,msg-flukso,Page 'On-site energy consumption' has been improved.,16/07/2012 19:01,0,,
TI-OpenLink,wl18xx_fw,"update PG2 FW version to 8.2.0.0.107 MAC Firmware version: 8.2.0.0.107 PHY Firmware version: 8.2.999.0.135 ili file updated. Updates in this version (from FW 102): - remove dencity - add ELP WA ;unmask WL8_BRINGUP_PATCH_YIELD_WA - remove WL8_WA_DISRESPECTABLE_HT_DENSITY; WA to tear down the BA session if we detect spacing of 8 usec - add force calibration on radio tune - increase Max aggergation size to 14 - Remove TCP check sum fro RX and Tx pipline - update HW Fifo sizes - Add stop tx stat - Add retry per rate stat - fix order of retrey in aggregation - Add tx monitor on AC trigger Busy - fix exception on update cashe attributes - MCS00115464 => new Rx parser compiler. - MCS00115494 => RSSI and Calibration results for RTTT. - MCS00115500 => BT/ELP changed sequence. - fix for BA open timeout - remove workaround for CW increment only after 2nd retry. - remove AC's priority fix (aifsn-1) - remove logger mux workaround for 189x. - generating fw global variable script for driver use - MCS00115516 => Fix TKIP problems from version 104 - warning cleanup - reduce ELP WU times - MCS00114518 TKIP as AP: udp_tx causes assert in IntMemBlockErr() (Oren S.) - disable power save in AP mode scan (Danny) - fixes for PD (still disabled in version) - add debug for pwrmgt activities - PHY version 135 - Add workaround for CCA ""clock-like""-toggle issue - TKIP Cisco fragmentation bug - Pre-TX Disable (+Disable switching PFM/PWM mode) - Work around for bad decrypted RX broadcast frames going to Host Signed-off-by: Ido Reis <idor@ti.com>",19/07/2012 13:21,0,,
kript,Monitoring-Stuff,Initial working version of power consumption iLo checking script Script to check the iLo of an HP Proliant G series server for its power consumption via the iLo port.,19/07/2012 20:49,0,,
CyanogenMod,android_kernel_samsung_aries,"ath9k: Fix kernel panic in AR2427 in AP mode commit b25bfda38236f349cde0d1b28952f4eea2148d3f upstream. don't do aggregation related stuff for 'AP mode client power save handling' if aggregation is not enabled in the driver, otherwise it will lead to panic because those data structures won't be never intialized in 'ath_tx_node_init' if aggregation is disabled EIP is at ath_tx_aggr_wakeup+0x37/0x80 [ath9k] EAX: e8c09a20 EBX: f2a304e8 ECX: 00000001 EDX: 00000000 ESI: e8c085e0 EDI: f2a304ac EBP: f40e1ca4 ESP: f40e1c8c DS: 007b ES: 007b FS: 00d8 GS: 00e0 SS: 0068 Process swapper/1 (pid: 0, ti=f40e0000 task=f408e860 task.ti=f40dc000) Stack: 0001e966 e8c09a20 00000000 f2a304ac e8c085e0 f2a304ac f40e1cb0 f8186741 f8186700 f40e1d2c f922988d f2a304ac 00000202 00000001 c0b4ba43 00000000 0000000f e8eb75c0 e8c085e0 205b0001 34383220 f2a304ac f2a30000 00010020 Call Trace: [<f8186741>] ath9k_sta_notify+0x41/0x50 [ath9k] [<f8186700>] ? ath9k_get_survey+0x110/0x110 [ath9k] [<f922988d>] ieee80211_sta_ps_deliver_wakeup+0x9d/0x350 [mac80211] [<c018dc75>] ? __module_address+0x95/0xb0 [<f92465b3>] ap_sta_ps_end+0x63/0xa0 [mac80211] [<f9246746>] ieee80211_rx_h_sta_process+0x156/0x2b0 [mac80211] [<f9247d1e>] ieee80211_rx_handlers+0xce/0x510 [mac80211] [<c018440b>] ? trace_hardirqs_on+0xb/0x10 [<c056936e>] ? skb_queue_tail+0x3e/0x50 [<f9248271>] ieee80211_prepare_and_rx_handle+0x111/0x750 [mac80211] [<f9248bf9>] ieee80211_rx+0x349/0xb20 [mac80211] [<f9248949>] ? ieee80211_rx+0x99/0xb20 [mac80211] [<f818b0b8>] ath_rx_tasklet+0x818/0x1d00 [ath9k] [<f8187a75>] ? ath9k_tasklet+0x35/0x1c0 [ath9k] [<f8187a75>] ? ath9k_tasklet+0x35/0x1c0 [ath9k] [<f8187b33>] ath9k_tasklet+0xf3/0x1c0 [ath9k] [<c0151b7e>] tasklet_action+0xbe/0x180 Cc: Senthil Balasubramanian <senthilb@qca.qualcomm.com> Cc: Rajkumar Manoharan <rmanohar@qca.qualcomm.com> Reported-by: Ashwin Mendonca <ashwinloyal@gmail.com> Tested-by: Ashwin Mendonca <ashwinloyal@gmail.com> Signed-off-by: Mohammed Shafi Shajakhan <mohammed@qca.qualcomm.com> Signed-off-by: John W. Linville <linville@tuxdriver.com> Signed-off-by: Greg Kroah-Hartman <gregkh@suse.de>",20/07/2012 7:47,0,,
geon,neupet,Implemented neural controll over movement/mating + adjusted energy consumption to allow offspring to survive. First signs of evolution,24/07/2012 9:38,0,,
jamescoxon,PicoAtlas,"working setup, first 1000 strings then into power saving mode, setup up to measure battery voltage and solar voltage",27/07/2012 7:11,0,,
triman1990,rpgContest,forgot about shield power consumption lol,28/07/2012 12:00,0,,
gentoo,munin,"sensors_: add support for power monitoring. This is already implemented with IPMI for some systems, but most boards do not report that. On the other hand, modern Opterons do report the power consumption for the CPU at least, which comes useful.",31/07/2012 2:00,0,,
CyanogenMod,android_kernel_samsung_aries,Update notes for submitted changes * bcmdhd: Disable MAX power saving mode as disabled by Samsung,31/07/2012 3:06,0,,
CyanogenMod,android_kernel_samsung_aries,"Merge ""bcmdhd: Disable MAX power saving mode as disabled by Samsung"" into jellybean",31/07/2012 3:06,0,,
mysmartgrid,msg-flukso,The legend of page 'On-site Energy Consumption' has been fixed.,02/08/2012 10:10,0,,
neilbrown,linux,"IIO: add iio driver for ITG3200 3-axis gyroscope. Each axis can be individually disabled to save power. Sample rate can be set. Appropriate clock is set automatically. No triggers implemented yet, so no streaming of data. Just read it from sysfs. Signed-off-by: NeilBrown <neilb@suse.de>",04/08/2012 12:17,0,,
cdebortoli,requiem_on_m13,Fix : Temperature and energy consumption.,05/08/2012 15:39,0,,
barney-parker,Arduino-Countdown-Timer,Standalone V1.0 Working on standalone board Currently No Switches Not using power saving due to lack of switch for interrupt...,12/08/2012 14:29,0,,
mysmartgrid,msg-flukso,Some bugs in page 'On-site energy consumption' have been fixed.,15/08/2012 15:42,0,,
